{
  "api_version": "v1",
  "artifact_count": 28,
  "artifacts": [
    {
      "bytes": 3560,
      "content_base64": "ewogICIkc2NoZW1hIjogInNjaGVtYXMvbWFuaWZlc3Quc2NoZW1hLmpzb24iLAogICJhcGkiOiB7CiAgICAicGFnZXNfYmFzZSI6ICJodHRwczovL2tvZHktdy5naXRodWIuaW8vcmFwcC1zdGF0aWMtYXBpcy9hcGkvcmFwcC13b3JrL3YxIiwKICAgICJyYXdfYmFzZSI6ICJodHRwczovL3Jhdy5naXRodWJ1c2VyY29udGVudC5jb20va29keS13L3JhcHAtc3RhdGljLWFwaXMvbWFpbi9hcGkvcmFwcC13b3JrL3YxIiwKICAgICJ2ZXJzaW9uIjogInYxIgogIH0sCiAgImF1dGhvcml0eSI6IHsKICAgICJhdXRob3JpdGF0aXZlIjogZmFsc2UsCiAgICAicHJvdG9jb2wiOiAiUkFQUC8xIiwKICAgICJzdGF0ZW1lbnQiOiAiVGhpcyBnZW5lcmF0ZWQgc3RhdGljIGRpc2NvdmVyeSBzdXJmYWNlIGlzIG5vbi1hdXRob3JpdGF0aXZlLiBTaWduZWQgUkFQUC8xIGZyYW1lcyBhbmQgc2lnbmVkIFJBUFAvMSByZWdpc3RyaWVzIHJlbWFpbiB0aGUgYXV0aG9yaXR5LiIsCiAgICAidmVyaWZpY2F0aW9uX3JlcXVpcmVkIjogdHJ1ZQogIH0sCiAgImJvdW5kYXJ5IjogewogICAgImdlbmVyYXRlZCI6IFsKICAgICAgImFwaS9yYXBwLXdvcmsvdjEvIgogICAgXSwKICAgICJpbnB1dHMiOiBbCiAgICAgICJhcGkvcmFwcC13b3JrL21hbmlmZXN0Lmpzb24iLAogICAgICAiYXBpL3JhcHAtd29yay9zY2hlbWFzLyIKICAgIF0sCiAgICAicm9vdF9idWlsZCI6ICJidWlsZC5weSIKICB9LAogICJjYXRhbG9ncyI6IHsKICAgICJwbHVnaW5zIjogWwogICAgICB7CiAgICAgICAgImFydGlmYWN0X3BhdGgiOiAiUkFQUF9XT1JLX1BMVUdJTl9SRUxFQVNFLmpzb24iLAogICAgICAgICJkZXNjcmlwdGlvbiI6ICJDb21taXQtcGlubmVkIHJlbGVhc2UgZGVzY3JpcHRvciBmb3IgdGhlIFJBUFAgV29yayBwbHVnaW4uIiwKICAgICAgICAiaWQiOiAicmFwcC13b3JrLXBsdWdpbi12MSIsCiAgICAgICAgImtpbmQiOiAicGx1Z2luIiwKICAgICAgICAibmFtZSI6ICJSQVBQIFdvcmsgcGx1Z2luIHYxIiwKICAgICAgICAicmVsZWFzZSI6IHsKICAgICAgICAgICJjaGFubmVsIjogInN0YWJsZSIsCiAgICAgICAgICAiY29tbWl0IjogbnVsbCwKICAgICAgICAgICJyYXdfdXJsIjogbnVsbCwKICAgICAgICAgICJzaGEyNTYiOiBudWxsLAogICAgICAgICAgInN0YXRlIjogImF3YWl0aW5nLWRvd25zdHJlYW0tY29tbWl0IiwKICAgICAgICAgICJ2ZXJzaW9uIjogIjAuMi4wIgogICAgICAgIH0sCiAgICAgICAgInJlcG9zaXRvcnkiOiAia29keS13L3JhcHAtYnJhaW5zdGVtLXBsdWdpbiIKICAgICAgfQogICAgXSwKICAgICJzZGtzIjogWwogICAgICB7CiAgICAgICAgImFydGlmYWN0X3BhdGgiOiAiUkVMRUFTRS1JTlZFTlRPUlkuanNvbiIsCiAgICAgICAgImRlc2NyaXB0aW9uIjogIkNvbW1pdC1waW5uZWQgcmVsZWFzZSBkZXNjcmlwdG9yIGZvciB0aGUgUkFQUCBXb3JrIFNESy4iLAogICAgICAgICJpZCI6ICJyYXBwLXdvcmstc2RrLXYxIiwKICAgICAgICAia2luZCI6ICJzZGsiLAogICAgICAgICJuYW1lIjogIlJBUFAgV29yayBTREsgdjEiLAogICAgICAgICJyZWxlYXNlIjogewogICAgICAgICAgImNoYW5uZWwiOiAic3RhYmxlIiwKICAgICAgICAgICJjb21taXQiOiBudWxsLAogICAgICAgICAgInJhd191cmwiOiBudWxsLAogICAgICAgICAgInNoYTI1NiI6IG51bGwsCiAgICAgICAgICAic3RhdGUiOiAiYXdhaXRpbmctZG93bnN0cmVhbS1jb21taXQiLAogICAgICAgICAgInZlcnNpb24iOiAiMS4wLjAiCiAgICAgICAgfSwKICAgICAgICAicmVwb3NpdG9yeSI6ICJrb2R5LXcvcmFwcC13b3JrIgogICAgICB9CiAgICBdLAogICAgInNraWxscyI6IFsKICAgICAgewogICAgICAgICJhcnRpZmFjdF9wYXRoIjogInNraWxscy9yYXBwLXdvcmsvYWdlbnQubG9jayIsCiAgICAgICAgImRlc2NyaXB0aW9uIjogIkNvbW1pdC1waW5uZWQgcmVsZWFzZSBkZXNjcmlwdG9yIGZvciB0aGUgUkFQUCBXb3JrIHNraWxsIGNvbGxlY3Rpb24uIiwKICAgICAgICAiaWQiOiAicmFwcC13b3JrLXNraWxscy12MSIsCiAgICAgICAgImtpbmQiOiAic2tpbGwiLAogICAgICAgICJuYW1lIjogIlJBUFAgV29yayBza2lsbHMgdjEiLAogICAgICAgICJyZWxlYXNlIjogewogICAgICAgICAgImNoYW5uZWwiOiAic3RhYmxlIiwKICAgICAgICAgICJjb21taXQiOiBudWxsLAogICAgICAgICAgInJhd191cmwiOiBudWxsLAogICAgICAgICAgInNoYTI1NiI6IG51bGwsCiAgICAgICAgICAic3RhdGUiOiAiYXdhaXRpbmctZG93bnN0cmVhbS1jb21taXQiLAogICAgICAgICAgInZlcnNpb24iOiAiMS4wLjAiCiAgICAgICAgfSwKICAgICAgICAicmVwb3NpdG9yeSI6ICJrb2R5LXcvcmFwcC1za2lsbHMiCiAgICAgIH0KICAgIF0KICB9LAogICJnZW5lcmF0ZWQiOiAiMjAyNi0wOS0xOFQxNDo1OToyMFoiLAogICJtb2RlIjogInByb2R1Y3Rpb24iLAogICJvZmZsaW5lX3NlZWQiOiB7CiAgICAiZm9ybWF0IjogImpzb24iLAogICAgInZlcmlmaWNhdGlvbiI6ICJzaGEyNTYtcmVxdWlyZWQiCiAgfSwKICAicHJvZmlsZSI6IHsKICAgICJkZXNjcmlwdGlvbiI6ICJHZW5lcmF0ZWQgZGlzY292ZXJ5IHByb2ZpbGUgZm9yIFJBUFAgV29yayBTREssIHBsdWdpbiwgc2tpbGwsIHJlbGVhc2UsIG9mZmxpbmUsIGFuZCByb2xsYmFjayBtZXRhZGF0YS4iLAogICAgImlkIjogInJhcHAtd29yayIsCiAgICAibmFtZSI6ICJSQVBQIFdvcmsiLAogICAgInByb3RvY29sIjogIlJBUFAvMSIsCiAgICAicm9sZSI6ICJub24tYXV0aG9yaXRhdGl2ZS1kaXNjb3ZlcnkiCiAgfSwKICAicmVsZWFzZV9wb2xpY3kiOiB7CiAgICAiY29tbWl0X3BhdHRlcm4iOiAiXlswLTlhLWZdezQwfSQiLAogICAgImZpbmFsX3N0YXRlIjogImZpbmFsIiwKICAgICJoYXNoX2FsZ29yaXRobSI6ICJzaGEyNTYiLAogICAgInBlbmRpbmdfc3RhdGUiOiAiYXdhaXRpbmctZG93bnN0cmVhbS1jb21taXQiLAogICAgInJhd191cmxfdGVtcGxhdGUiOiAiaHR0cHM6Ly9yYXcuZ2l0aHVidXNlcmNvbnRlbnQuY29tL3tvd25lcn0ve3JlcG99L3tjb21taXR9L3thcnRpZmFjdF9wYXRofSIsCiAgICAicmVxdWlyZV9jb21taXRfcGlubmVkX3Jhd191cmwiOiB0cnVlCiAgfSwKICAicm9sbGJhY2siOiB7CiAgICAicnVsZXMiOiBbCiAgICAgICJWZXJpZnkgdGhlIGltbXV0YWJsZSByZWNlaXB0IGJ5IGl0cyBmdWxsIFNIQS0yNTYgYmVmb3JlIHVzZS4iLAogICAgICAiU2VsZWN0IG9ubHkgYSBmaW5hbCByZWxlYXNlIHdpdGggYSA0MC1oZXggY29tbWl0IHBpbiBhbmQgbWF0Y2hpbmcgY29tbWl0LXBpbm5lZCByYXcgVVJMLiIsCiAgICAgICJWZXJpZnkgdGhlIGRvd25zdHJlYW0gYXJ0aWZhY3QgZnVsbCBTSEEtMjU2IGJlZm9yZSBsb2FkaW5nIGl0LiIsCiAgICAgICJTaWduZWQgUkFQUC8xIGZyYW1lcyBhbmQgc2lnbmVkIFJBUFAvMSByZWdpc3RyaWVzIHJlbWFpbiB0aGUgYXV0aG9yaXR5LiIKICAgIF0sCiAgICAic3RyYXRlZ3kiOiAicmVjZWlwdC1wbHVzLWNvbW1pdC1waW4iCiAgfSwKICAic2NoZW1hIjogInJhcHAtd29yay1zdGF0aWMtYXBpLW1hbmlmZXN0LzEuMCIKfQo=",
      "name": "manifest",
      "path": "api/rapp-work/manifest.json",
      "sha256": "fd1615ee12d54fd511be2cf5b84a1fbff714fb27fd60d68862a0a7a7f5be3006"
    },
    {
      "bytes": 1103,
      "content_base64": "ewogICIkaWQiOiAiaHR0cHM6Ly9yYXcuZ2l0aHVidXNlcmNvbnRlbnQuY29tL2tvZHktdy9yYXBwLXN0YXRpYy1hcGlzL21haW4vYXBpL3JhcHAtd29yay9zY2hlbWFzL2FydGlmYWN0LXNuYXBzaG90LnNjaGVtYS5qc29uIiwKICAiJHNjaGVtYSI6ICJodHRwczovL2pzb24tc2NoZW1hLm9yZy9kcmFmdC8yMDIwLTEyL3NjaGVtYSIsCiAgImFkZGl0aW9uYWxQcm9wZXJ0aWVzIjogZmFsc2UsCiAgInByb3BlcnRpZXMiOiB7CiAgICAiYXBpX3ZlcnNpb24iOiB7CiAgICAgICJjb25zdCI6ICJ2MSIKICAgIH0sCiAgICAiYXJ0aWZhY3RfY291bnQiOiB7CiAgICAgICJtaW5pbXVtIjogMSwKICAgICAgInR5cGUiOiAiaW50ZWdlciIKICAgIH0sCiAgICAiYXJ0aWZhY3RzIjogewogICAgICAiaXRlbXMiOiB7CiAgICAgICAgIiRyZWYiOiAiY29tbW9uLnNjaGVtYS5qc29uIy8kZGVmcy9hcnRpZmFjdFNuYXBzaG90UmVjb3JkIgogICAgICB9LAogICAgICAibWluSXRlbXMiOiAxLAogICAgICAidHlwZSI6ICJhcnJheSIKICAgIH0sCiAgICAiYXV0aG9yaXR5IjogewogICAgICAiJHJlZiI6ICJjb21tb24uc2NoZW1hLmpzb24jLyRkZWZzL2F1dGhvcml0eSIKICAgIH0sCiAgICAiZml4dHVyZV9tb2RlIjogewogICAgICAidHlwZSI6ICJib29sZWFuIgogICAgfSwKICAgICJmaXh0dXJlX25vdGljZSI6IHsKICAgICAgInR5cGUiOiAic3RyaW5nIgogICAgfSwKICAgICJnZW5lcmF0ZWQiOiB7CiAgICAgICIkcmVmIjogImNvbW1vbi5zY2hlbWEuanNvbiMvJGRlZnMvZ2VuZXJhdGVkIgogICAgfSwKICAgICJzY2hlbWEiOiB7CiAgICAgICJjb25zdCI6ICJyYXBwLXdvcmstc3RhdGljLWFwaS1hcnRpZmFjdC1zbmFwc2hvdC8xLjAiCiAgICB9CiAgfSwKICAicmVxdWlyZWQiOiBbCiAgICAic2NoZW1hIiwKICAgICJnZW5lcmF0ZWQiLAogICAgImFwaV92ZXJzaW9uIiwKICAgICJmaXh0dXJlX21vZGUiLAogICAgImF1dGhvcml0eSIsCiAgICAiYXJ0aWZhY3RfY291bnQiLAogICAgImFydGlmYWN0cyIKICBdLAogICJ0aXRsZSI6ICJDb250ZW50LWFkZHJlc3NlZCBSQVBQIFdvcmsgYXJ0aWZhY3Qgc25hcHNob3QiLAogICJ0eXBlIjogIm9iamVjdCIKfQo=",
      "name": "artifact-snapshot",
      "path": "api/rapp-work/schemas/artifact-snapshot.schema.json",
      "sha256": "2be403797a5ad6ffb8cc612535b09b0742c39bab77c71e6abbb24855f4e7ccb3"
    },
    {
      "bytes": 9268,